hoshizora	凛「みんな話ってなにかにゃ?」 穂乃果「凛ちゃんって人気無いよね~」 凛「え……」 ことり「凛ちゃん、臭いから近寄らないでね」 海未「あなたはいつも不真面目で人に迷惑ばかりかけていますね。正直言って邪魔なんです」 希「μ'sはやっぱり8人でいいってカードが言うてるよ」 凛「……凛何か悪いことしたかな…」 にこ「凛、死になさい」 絵里「言わなくても分かってるわよね?すぐに退部届を書きなさい」 真姫「あなた本当に気持ち悪い」 凛「……」 花陽「バイバイ凛ちゃん。もう二度と話しかけないでね」
hoshizora	凛ちゃんのぽんぽんすべすべ
toosaka	ツンデレなのに一番優しいという
shibuya	武内P「渋谷さんあなた・・・こんなご趣味があったとは 今度検討してみます。」
toosaka	うむ 凛は可愛いのだ。それは揺るがない
matsuoka	凛ちゃんは泳ぎがカッコ良いのに弱いからな… でもモブのことは水泳関係なく好きになってしまったんだよね
toosaka	UBW凛の戦闘での見せ場というと来週のガンドとキャスター戦になるのかな でもここまで見ると戦闘も増えそうで楽しみ
matsuoka	-255 各ポジションにどれだけの彼氏置くつもりなんだろ 凛ちゃんビッチすぎる。今後更に増えそう
toosaka	制服凛は可愛いというか美しい
matsuoka	客に言ったんじゃなくて?
hoshizora	可愛すぎ泣いた
matsuoka	凛ちゃんがいればラリアにも満開の桜が…!?
matsuoka	まさかのらぶりんくそわろwwwwwwwwwwww 公式は本当人外→凛ちゃん好きだな どんだけ総受けに餌撒く気だwwww
matsuoka	そりゃ周囲の将来性あるいい男の心をことごとくかっさらっていくんだからな… 塩対応にもなるという話
matsuoka	百も成長したら良い婿候補だと思うで 兄に負けず劣らずスペック高い
toosaka	アメジスト?色盲なんか?
hoshizora	負けるとわかってても男には戦わねばならぬ時がある 凛ちゃんにポチ
matsuoka	一緒に泣こう
matsuoka	じゃあモブは水着でいいよ
shibuya	完璧落ちてるわこれ
shibuya	バックで中に出されたのにキレて後ろ蹴りされたい
toosaka	アニメはアーチャーと凛推しだからあまり期待してない でもセイバーと凛とのデート回はあると嬉しい えへへキスしちゃったは無理だろうけどこっちは描写しにくい所も無いと思うし
shibuya	かわいい
matsuoka	彼氏多すぎだろ
shibuya	> 後は武内Pの録音ボイスって可能性がせいぜい7割~8割くらいだろうね うん 高くてワロタ
shibuya	「夢中になれるもの」は殻を破った自身の中にあったってオチだと思っているんだが、 殻破るとこうなっちゃうの?
matsuoka	貴凛wktk
hoshizora	こっちは新聞3号もらえたにゃ
matsuoka	萌え袖ショタ凛ちゃんのミニスカサンタ可愛いよ 柔らかい太ももに腕やらナニやら挟んでもらうよ
hoshizora	凛ちゃん不細工だよ
shibuya	人生経験若しくは妄想力が不足してる 精進しろ
matsuoka	凛ちゃん美人だよ顔舐め回したいよ
toosaka	何色だったの?
toosaka	CCCか… extraのゲーム部分がキツかったから敬遠してたんだよなぁ
toosaka	コンプエース
hoshizora	海未ちゃんだったにゃ・・・
hoshizora	お前のは腐ったバナナにゃ
toosaka	女という年じゃない、色香が足りない、優雅さも不足だ、可愛さがわかりづらいと言われるシーンをバスタオル姿やエロカワイイシーンに映像化するufoのスタッフに吹いたw
matsuoka	乙 モブにだって彼氏になれるチャンスはある
shibuya	痴漢は綺麗系よりかわいい系を狙う むしろ卯月が危ない
toosaka	おいおい天使か
hoshizora	疲れた
matsuoka	りんちゃんって本当にかわいい名前だよなぁ
toosaka	ID:POqrzoyK0がどんどん追い詰められて人格攻撃やら罵倒しかできなくなってるのが滑稽でつい ごめんなさいm(_)m
hoshizora	凛ちゃんはかっこよさも可愛さも兼ね備えてるね
toosaka	時計塔でジャーマンスープレックスかけられてK.O.されてるよ
hoshizora	凛ちゃんおやすみ
matsuoka	そんなんあんの? 凛ちゃんは一月に一日そういう日があってもいいな イキすぎてもう潮吹きしか出来ない凛ちゃん取り囲んで更にぶっかけよう
matsuoka	モブの被害妄想
matsuoka	ちょっとつり目じゃない?美人だ
shibuya	とりあえずしぶりんに踏んでほしいね
matsuoka	難民に避難用のスレ立てないのかな?
shibuya	いやいや、俺が
matsuoka	渚のいるところにらぶりん在り 渚は毎回襲われる凛ちゃんを観てるのだろうか
hoshizora	戦利品 上は前のローソンだけど 1000円突っ込んだがラーメンは取れなかったorz
toosaka	凛さん弱いところ多いよな… 攻めまくりたい
shibuya	お約束展開にムキになんなくても…(´・ω・`)
hoshizora	docomo解禁になったからってはしゃがんでエエねんで
shibuya	荒ぶる渋凛のポーズ どんなポージングかな?
hoshizora	繁体字と簡体字ならこの「凜」だからって言おうとしたけど、さんずいだし回の上無いし下に木がついてるし絵理だし…
shibuya	これはこれで卯月の顔が大きく見えるという
toosaka	士郎狙ったこと知ったら怒るんじゃないか
hoshizora	バラバラ凛ちゃん
shibuya	凛は匂いフェチだな 自分が嗅がれるのも好きそうだし たまんねえわ
matsuoka	タダまん楽勝。ヤって損はなし。 pa♂rty-roc♂king.♂com/uraura/305.jpg ♂はヌキで。
hoshizora	【ラブライブ!】星空凛ちゃんはねこちゃんダンスかわいい 【ラブライブ!】星空凛は2スレ目で感動できるなんて羨ましいにゃ~ 【ラブライブ!】星空凛はテンション上がるにゃー!かわいい>ω</3 【ラブライブ!】星空凛はまじえんじぇー可愛い>ω</4 【ラブライブ!】星空凛はまじえんじぇー可愛い>ω</5 【ラブライブ!】星空凛はまじえんじぇー可愛い>ω</6 【ラブライブ!】星空凛は伝説の美少女可愛い>ω</7 【ラブライブ!】星空凛は11/1生まれのまじえんじぇー可愛い>ω</8 【ラブライブ!】星空凛は凛だって女の子だもん!可愛い>ω</9 【ラブライブ!】星空凛は素直になれずにいたの可愛い>ω</ 10 【ラブライブ!】星空凛はフェアリー可愛い>ω</ 11 【ラブライブ!】星空凛は最強なんだにゃ☆可愛い>ω</ 12 【ラブライブ!】星空凛は崖っぷちでも可愛い>ω</ 13 【ラブライブ!】星空凛ちゃんは凛まげでも可愛い>ω</ 14髷目 【ラブライブ!】星空凛は作詞に来たはずにゃ~可愛い>ω</ 15 【ラブライブ!】星空凛は不本意だにゃ~可愛い>ω</16 【ラブライブ!】星空凛は抱き締めちゃいたいくらい可愛い>ω</17 【ラブライブ!】星空凛ちゃんはお広がりになって可愛い>ω</18 【ラブライブ!】星空凛はスイス~イ可愛い>ω</19スプラッシュ目 【ラブライブ!】星空凛ちゃんはそうにゃそうにゃ可愛い>ω</20 【ラブライブ!】星空凛ちゃんは大成功にゃ(≡>ω<≡)可愛い 21 【ラブライブ!】星空凛ちゃんは見守るYELLOW STAR可愛い>ω</22 【ラブライブ!】星空凛は踊るのが大好き可愛い>ω</23 【ラブライブ!】星空凛は梅雨でもブルブルにゃーん可愛い>ω</24 【ラブライブ!】星空凛ちゃんは一発逆転にゃ可愛い>ω</25発目 【ラブライブ!】星空凛ちゃんはにゃは~ん可愛い>ω</26 【ラブライブ!】星空凛ちゃんは1,2,3,4,ジャジャーン可愛い>ω</27 【ラブライブ!】星空凛ちゃんは次期リーダー!可愛い>ω</28 【ラブライブ!】星空凛ちゃんはくるりんMIRACLE可愛い>ω</29
hoshizora	凛ちゃんおやすみなさい
hoshizora	楽しみだからあえて聴かない方針でいく
shibuya	俺も校則に引っかからんのかな、ぐらいには気になったけどな っていうか、みたいに質問者を無意味に煽る奴は死んどけや
hoshizora	かよちんのディナーみたいな分かりやすいのがあればいいんだけどね サッカーの本場スペインのカンプノウでバルセロナの試合を見に行きたいキャラは?みたいな
toosaka	ううっ、光栄です
hoshizora	俺焦らされるのは苦手だからはよ
matsuoka	モブもかわいいモブ
matsuoka	こんなにビッチな男の子他にいないよな… しかも無自覚にノンケを惚れさせるとかタチが悪い
shibuya	正妻!
hoshizora	今更凛ちゃんソロ2弾のアルバムを聴いている訳だが おまえらこんないいものずっと聴いてたんだな 危うくWonder zoneの冒頭で萌え死にかけたよ あぁ^~凛ちゃんの声がかわいいんじゃ^~
matsuoka	モブが漁に出るかどうかなんて凛ちゃん気にしてないんだよなあ
hoshizora	至高のりんぱな
matsuoka	テンプレは同じでいいしスレ番号はどうする 13.5?避難所?
shibuya	なんで凛ちゃんの制服姿はこんなに性的なんだろう
toosaka	あ、ごめん。スレ更新してなかった
matsuoka	むしろ彼氏いっぱいいすぎて 凛ちゃんのクリスマスのスケジュール分刻みなんじゃない?
shibuya	わ か る わ
shibuya	みんなまだ童貞してるのー?
matsuoka	凛ちゃんだんだん欲しくなっちゃうじゃん
matsuoka	さおにはいっさい触らずに凛ちゃんが泣き出すまでふにふにふぐりをマッサージしてあげたい お風呂あがりのホカホカの体をお姫さまだっこでベッドに運んで脚を開かせる そして手のひらで人肌に温めたベビーオイルでふにふにふぐりを優しくマッサージマッサージ... 太もものつけねからおしりのラインも手を滑らせるようにしながら何度も往復させてマッサージマッサージ...
shibuya	しぶりんは痴漢に遭っても泣き寝入りどころか撃退するかもしれない。 意外と喧嘩も強そうだし。
matsuoka	まこちゃんは泣いていいんだよ凛って言ってくれそう
toosaka	ただいま凛ちゃん
hoshizora	今年のクリスマスプレゼントは同じ星が見たいだな
hoshizora	凛ちゃんおはよう
toosaka	凛ちゃんと一緒にロンドン行ってくる
hoshizora	凛ちゃんボコボコボコボコボコボコボコボコボコボコボコボコボコボコボコボコボコボコボコボコボコボコボコボコボコボコボコボコボコボコボコボコボコボコボコボコボコボコボコボコボコボコボコボコ
matsuoka	バレス 一応名前は呼んだけどそれほど仲良くはなってない ただギスってはいないかな でも冬の日と卒業パーティではまた苗字に戻ってるんだよねw
hoshizora	今日給料日 スクフェスで朝LP消費後帰り道にチュンカ買ってくるから単発回しちゃおうと残った5個で引いたら人魚凛ちゃん!
hoshizora	おつにゃ!
toosaka	くさそう
shibuya	凛ちゃん、おはよう!!
hoshizora	ねるりん
shibuya	似合うからこそ笑えるってもんで
toosaka	凛、起きよう
toosaka	それ凛の格好した俺だよ
shibuya	可愛い
hoshizora	凛ちゃんCM来たよ [福岡限定] ラブライブ! Blu-ray スペシャルTVCM (担当:星空凛) [TVQ]
shibuya	強すぎる邪気の威圧感で巨大に見えていただけだよ
toosaka	一番くじ凛好きには美味しいなwww ボードサイズどの位だろう
shibuya	りんちゃんの女子高生スタイルたまらん この歳になってアニメキャラにはまるなんてはずかしい…
shibuya	ラーメン屋でバイトする凛ちゃん可愛い
matsuoka	乳首見せながら桜も咲かせる凛ちゃんさすが
shibuya	本当に当然だからなあ その言い方は無いも何も当たり前すぎて その辺りは散々言われてるけど
matsuoka	苺に練乳
matsuoka	凛ちゃん彼氏多すぎる モブの入る隙が無い
matsuoka	ドラマCDバレス 御子凛あんの?
toosaka	今回は結構議論されてるなあ 凛ちゃんのオリジナルシーンは評判良さげだけど
shibuya	あれはアスランのドラマ()だそうだからアスランが主人公だぞw 無駄に出番多いだけで軋轢ばかり生み出し国や軍や仲間を何度も裏切る外道だったけどな キラやシンより優しくて誠実なキャラらしいが劇中じゃ誰の心も掴めてない前代未聞の主人公w
hoshizora	乙にゃ~
hoshizora	おかえりん! チケットケースの凛ちゃん雪だるま かわいいにゃー
shibuya	まだ円光円光言ってる馬鹿がいるのか
matsuoka	汁男優扱いだろうな 挿入は彼氏オンリー
matsuoka	負けたら何でも言うこと聞くって本当ヤバいな…
toosaka	今更気づいたけど、遠坂邸って洋館だから土足なんだな 高温多湿な日本だと蒸れそうだな
shibuya	堂々としてる童貞は案外女子にうけがいいみたいやぞ 安心するねんて おまえらがんばれよ! おれは引っ越しするから
shibuya	渋凛が俺の嫁すぎてツライ……
matsuoka	遙さんは確実だな 憧れてるくらいだし凛ちゃんドキドキ
matsuoka	1期で遙凛は指輪と拳コツンしてたのにサングラスになっててワロタw 他の男を被ると速攻でアイテム変える凛ちゃんビッチ杉内
hoshizora	町田ゲマ行ったら羊凛ちゃんがいた
toosaka	桜のスレは15も進んでるのにゴキブリスレはまだ1スレ目 人気無さ過ぎ
toosaka	PC版のHollowが出たころはファンディスクも出たしこれで終わりだろうと思ってました まさかここまで派生作品が増えるとは…
matsuoka	凛ちゃんは無垢な体だったよ JBに出会うまではね
hoshizora	凛ちゃん可愛い
shibuya	もうデレマスのPは武内Pでイメージ固定化されてしまったから同人のオリジナルPを見るとNTR感がある
shibuya	あの素っ頓狂な「は?」は癖になる
matsuoka	つまりモブにもワンチャンある
toosaka	きのこが太鼓判押したという5話のガンド 一体どんな感じになっているのか
toosaka	すきあらばと言っていた凛の不可視の下着を風呂上がりの着替えという形で単体で見せてきたのにはその執念に参ったよ その割には胸が減量されてたが。顔が男になってたが
hoshizora	取ってないプライスを取りに行こうかな
shibuya	楽しんで見てる人もいるのにそういうのをいうのはよくない
hoshizora	凛ちゃんおはよう
toosaka	つうか、それが全てのような。お茶目に可愛い声で尻を振りおって! 思わず叩きたくなるじゃあないか!叩いたらぱちーんといい音と、引き締まった尻肉の震えと 凛の嬌声が聞けると思うと、変態紳士の魂がうずくわ
shibuya	乙
shibuya	リア充はセックスするからオナニーする必要ないだろ
hoshizora	フィギュア欲しいけど40ポイント集めるのはちょっと無理だな クリアファイル何枚かであきらめよう A2サイズクリアポスターのところ画像間違ってるし
toosaka	凛のあの赤い服の緩やかなふくらみ、絶対領域とスレンダーなふともも、黒プリーツスカートでも隠せないつんとした可愛いお尻 これにツンデレ黒髪ツインテとかもはや神がかってるよな
hoshizora	そもそもその話を初めて聞いたのだけれども
hoshizora	クリスマスだよ凛ちゃんおやすみ
hoshizora	おやすみ凛ちゃん
shibuya	他の子じゃなくて凛ちゃんのパンツが見たいんですよ。早くしてください
matsuoka	もモブは?モブはどこが頂けるんですか?(震え声)
matsuoka	ダメ 乳首お披露目はモブと凛ちゃんの結婚披露宴の時って決めてるから
shibuya	お泊りしちゃった…みたいな絵
shibuya	前回とはレベル違いすぎだろ。顔がやばいよ
toosaka	やっぱりミニスカですよミニスカ!
shibuya	GJ!!
hoshizora	寒い日は凛ちゃん手袋
hoshizora	こないだ花陽ちゃんと凛ちゃんと買い物に行ったけど凛ちゃんが側に近寄るたびに腐った魚のような臭いが… もう凛ちゃんとはいっしょに出かけたくありません
hoshizora	蟹って何気に凛ちゃん嫌いな社員いるよな イベントの時期とか今回のシチュとか
toosaka	(UBWになってから)初スレだよ
matsuoka	まこちゃんがのんきにしてる間に凛ちゃん抱くモブー
hoshizora	凛ちゃんは可愛いけど中の人は不細工だなw 公式サイト見るんじゃ無かった
shibuya	円光してそう
toosaka	凛は美乳なのであの大きさでいいんですよ
hoshizora	凛ちゃんからザリガニみたいな臭いがする 近寄らないでほしい
toosaka	カプさばの凛も可愛い 凛とちびアーチャーのコンビも好きだな
matsuoka	凛ってムカつくって言われてイってほしい
toosaka	阿波踊りというか茶摘み娘に見えるな
shibuya	よそのスレじゃ凛の話よく出るのに 本人のスレは過疎り気味なのな
toosaka	先週今週分はルートの中でも登場少ないパートだからね このスレ的には息抜きだな
matsuoka	まこりんはるりんももりんは響きが可愛い そもそも凛ちゃんは名前もが「りんっ♪」って感じで可愛い
matsuoka	一生一人だと覚悟していた自分にも出来てしまった {アワビ}と◎を取る↓↓ {アワビ}d◎akku◎n.n◎e◎t/c11/0225rana.jpg
hoshizora	凛ちゃんの頭かち割る
toosaka	はいてない
hoshizora	凛ちゃんおやすみ
hoshizora	凛ちゃんはラーメンが好きで魚が嫌い・・・ 魚介系ラーメンは?
shibuya	梅
hoshizora	凛ちゃんほしいけどソニックが憎いというジレンマ
toosaka	はいめちゃシコでした
toosaka	女子高生は寒くてもミニスカートだからな、上はコートで下はミニスカート っていう格好してる女子高生可愛いからあれはあれでいい。
hoshizora	美味しいにゃ~!
matsuoka	バレス 名前呼びだけど関係は多少改善されたくらいなのか 14話のバレ見ると3P可能でどっちが凛ちゃん気持ちよくさせるかで争いそうなイメージだけど 冬の日と卒業パーティーでまた関係戻るなら難しいねw
matsuoka	世界が凛受けに優しすぎる
toosaka	いや弓凛ちゃんは女達が大好物だから 弓さえ気にならなきゃ凛ちゃんの絵は大量に拝めるの間違いなし
shibuya	二次創作の凛は犬耳と尻尾でも生えてそうなくらいPに懐いてるよな 他のアイドルと喋ってると目ざとく割り込んでくるし
hoshizora	ただいま凛chan
matsuoka	らぶりんの集団が凛ちゃんを触手レイプ…?
matsuoka	イきまくって苦しくてアヘる凛ちゃん助けてあげたいけど抱き締めたりするとそれも快感になっちゃうんだろうか
toosaka	おそろいですね
matsuoka	その2人が似てるって萌えるよね 凛ちゃんの涙に弱いとか対凛ちゃんへの演出も被せてるしほんとそっくり 凛ちゃんの男の趣味が分かりやすすぎて困る
toosaka	おは凛
shibuya	普通にいってくれそうだが 犬に見えるよ
toosaka	kawaii
shibuya	ああ
matsuoka	凛ちゃん総選挙やろう
shibuya	いいね
matsuoka	凛ちゃんビッチだからモブのちんぽも大好きだし!
hoshizora	凛ちゃんは手なら1000円 口なら3000円 下の口なら5000円
matsuoka	遙凛宗凛真凛怜凛百凛キス凛モブ凛の8Pか~ 日頃から鍛えてる凛ちゃんなら二周は余裕だね 彼氏たちのためにトレーニング頑張る凛ちゃんマジ天使
hoshizora	凛ちゃんのお尻の穴ペロペロ
hoshizora	特典曲もしかして凛ちゃんセンター!?
hoshizora	自分でやってみると絶対この角度にならない
toosaka	何で小さいゴキブリいきなり発情した顔してたの?
shibuya	Oh…
hoshizora	この糞猫ほんと気持ち悪いな さっさとアイドル辞めちまえ
toosaka	凛ちゃんの可愛さに目覚めました
hoshizora	凛ちゃん、寒いから一緒なお布団で寝ようね
matsuoka	凛ちゃんまこちゃんの声にうっ…ってなってたのに宗介の声にヤラれてたよね 声だけなのにどんだけビッチなの?
hoshizora	フィギュア目当てならアルター待ちでもな
shibuya	しぶひりんかわいすぎワロタwwwww しぶひいいいいいいいいいいいいいいいりんだわwwwww
shibuya	3話から張ってる
hoshizora	【ラブライブ!】星空凛は凛ちゃんラーメン可愛い>ω</30杯目 【ラブライブ!】星空凛は最強カンフーアイドル可愛い>ω</31発目 【ラブライブ!】星空凛はシャボン玉キック可愛い>ω</32蹴目 【ラブライブ!】星空凛はわーいくるくる可愛い>ω</33くるりん 【ラブライブ!】星空凛はメイド姿もかわいい>ω</パフェ34丁 【ラブライブ!】星空凛はいえーすきらきら可愛い>ω</35 【ラブライブ!】星空凛はセガイメージガール可愛い>ω</36
toosaka	きのこの場合 口に出さなくても(インタビューで答えてるけど)凛好きなの見え見えだからな あいつも人間だもの
toosaka	パンツ見せちゃったら優雅じゃなくなっちゃうからね
shibuya	欲しい(確信)
shibuya	でもキッて我慢してる凛ちゃんを想像すると… ゴクリ…
hoshizora	おやりん
hoshizora	持ってる本の表紙がひつじなのは真姫が牡羊座だからかな
matsuoka	そもそもモブは凛ちゃんのふぐりにたどりつけないんだよなあ
matsuoka	お花凛ちゃんに受精してもらお
matsuoka	桜のプールは桜咲かせたわけじゃないだろ ビッチじゃないよモブに一途だよ
shibuya	さっすが~ P様は話が分かるっ!
matsuoka	乙です! これでちょっと安心した
shibuya	天下欲しいにゃ(>ω<)! シンデレラガールズ第4回総選挙スレ [転載禁止]&#169;2ch.net
matsuoka	凛ちゃん知ってたけどやっぱりいじられヒエラルキー低いw
hoshizora	凛ちゃん全然人気ないんだね
hoshizora	凛ちゃんおやすみ
matsuoka	バーバーらぶりんw 凛ちゃん見ると目がハートになるんだな
hoshizora	セリフ凛ちゃん→にこ→希で繋がってるみたいね
shibuya	デレマス、しぶりん以外つまらなくて苦痛 まぁしぶりんの為に観るけど 一人だけ場違いなJKがコミケに混ざり混んでいる感 しぶりんが主役のPA辺りの青春アニメが観たい
hoshizora	凛ちゃんおやすみ
shibuya	所詮ゆとりのクソガキだということが分かってしまったね
toosaka	凛みたいな細身が一番好みだ
shibuya	乙 凛ちゃんみたいな前髪はどうやって作ってるのか気になる
matsuoka	「今度見に来いよ…(やさしい声)」これは誘ってますわ
toosaka	きのこ「遠坂凛はツンデレじゃなくて姉御肌なだけ」
toosaka	そういや電撃文庫から出るんだよねFateの後日談?に当たる小説 デュラララの成田さんが書くってやつ やっぱ解体の話になるのかな? 凛ちゃんとウェイバー、他のキャラとのかけあいが凄く楽しみだ
toosaka	声付きでやるといいなありゃ、その後でセイバーを策略にはめる鬼畜っぷり最高
matsuoka	凛ちゃんが優しく抱っこしてくれて桜乳首吸わせてくれる
toosaka	やかん取りに立ち上がって小走りするとこ可愛い
matsuoka	凛ちゃんのツンデレって全然ツンじゃないよ デレが駄々漏れで可愛すぎる
toosaka	なんか原作より威力上がってた気がするなww
hoshizora	おやりん
hoshizora	凛ちゃん鯖おいしかった?
hoshizora	どうせあれだろ アフリカだし動物一杯だから凛ちゃんはここでいいやろみたいな 違う、そうじゃない…そうじゃないんだよ…
toosaka	凛のBADは次回のやつだな
toosaka	やっぱり色々台無しだよ! ぱんつが見えてるとかおっぱいがありすぎるとか髪の毛がやわらかそうじゃないとか目が青くないとか恥じらいがないとか、 青セイバーと赤王様以上に別人だよ(泣)
hoshizora	凛ちゃんに会いたいな… 会ってお話ししたい
matsuoka	アニメジャパンのニュータイプブースに展示されてる紘子監督の色紙が凛ちゃんで乳首
matsuoka	修正される前の凛ちゃんがちょっと大人びた感じで 修正された後の凛ちゃんはちょっといたずらっこっぽい感じで どっちもめっちゃ美人
matsuoka	手じゃなくてチンコが滑ったんですね
shibuya	ショートとツイン可愛いな
