toosaka	凜「ルヴィアがいない学校なんて」 士郎「お互いに仲が悪いだろうが」 イリヤ「それは違うよ!お兄ちゃん、喧嘩する相手がいなくて寂しいんだよ」
shibuya	お前何時も荒ぶってんなと思いつつ心が落ち着く
matsuoka	何その存在しないルート
matsuoka	チェンジャケBのラブリンかわいい ラブリンがモブに噛まれたぷっくり凛乳首を優しく癒すよ
toosaka	んじゃこっちどうぞ 奈須氏: そう。分かりやすい言い方をすると,例えば青子だったら,彼女にスターシステムを適用するのは抵抗ないんですよ。 実際TYPE-MOON作品には,彼女を原点とした同系統のキャラクターが登場していますし。 4Gamer: 月姫の遠野秋葉や,空の境界の黒桐鮮花,Fateの遠坂 凛などですね。 奈須氏: 「勝気なお嬢様的ポジション」ってやつです(笑)。一方,有珠のポジションにほかのキャラクターを置くことはしたくない。 自分にとって,どうしても汚しがたい,オンリーワンの立ち位置ですね。……まあ,有珠というキャラクターで語るべき事は「まほよ」ですべてやる,という点もあるのですが。
hoshizora	アクリルスタンド、一発で凛ちゃん通常verツモったにゃ これが愛にゃ ソニック凛ちゃんどんくらい入ってるんだろうね?
hoshizora	セガールで伸びてるかと思ったらレス番飛んでるだけか 悲しいなぁ
matsuoka	兄柴が凛ちゃんを凄く優しい目で見守ってるシーンを見た時から御子凛に目覚めたよ 最終回終わった後にあの優しい目どっか他でも…と思ったら宗介のコーラ顔だった
toosaka	そりゃ今ゴキブリはアニメ()実質セイバールートでブーストかけてもらってるからね~ 少しは健闘しないとね でもね 映画公開後にはね、圧倒的に桜にも負けるレベルのゴミなのよ ゴキブリはね
hoshizora	最後に貼ってく
hoshizora	ライオン凛ちゃんならある
matsuoka	量産型お尻んちゃん…ごくり あのエロい尻がモブのために量産型に
hoshizora	おはりんちゃん
hoshizora	可愛さ余って憎さ百倍つってね
toosaka	Fate/stay night @Fate_SN_Anime コミケ87企業ブース&全国アニメイト大型店にて配布するメーカー横断アニメガイド2014冬にて、描き下ろしイラスト&岩上Pインタビューを掲載!配布詳細はこちら #fate_sn_anime アーチャー裏山
hoshizora	ライブか! ありがとう、すっかり忘れてた
matsuoka	(これ遙さんご褒美しかないよね?)
hoshizora	プレイしないと1ヶ月だか何ヶ月だかでメダル貯金って無くなるだろ
shibuya	お前がな
matsuoka	モブは凛ちゃんとCDの貸借でもしてな そういうモブ居たよね
toosaka	というか遠坂さん歌える曲あるんだろうか
matsuoka	気丈に振る舞うけど本当は情けなくて怖くて仕方ない凛ちゃんペロペロ
toosaka	次は精々自宅で「アーチャー帰ってくるの遅いなー」というシーン位しか追加できなそうだな 一瞬でも出ればいいんだが ED曲CDの三曲目が凛ぽくてイイ
matsuoka	花冠かぶせて可愛い可愛い言ってた渚くんもなかなか
shibuya	足長いな
shibuya	俺的にfigmaを再販して欲しい
toosaka	これはいいですゾー
hoshizora	凛ちゃんおやすみなさい
matsuoka	冷たい手を凛ちゃんの服の中に忍ばせたい 凛ちゃんの素肌で暖を取りたい
matsuoka	さすが猫の日 凛にゃんが可愛いぜ
toosaka	zeroの時は出てたよな SNもやるんじゃね
toosaka	ソファに腰掛けてるシーンはめちゃシコ
matsuoka	まこちゃんのお面するからモブだってバレない
hoshizora	そに凛フィギュアのサンプルが見たいにゃー
toosaka	そうだよ
hoshizora	糞猫死ね
toosaka	あと3日だ
matsuoka	凛ちゃんは男みたいな脇毛はえないよ ふあふあやわらか猫っ毛がふんわり少量はえる程度
matsuoka	まず黒髪青目で生まれます (叶わない場合は父性を手に入れましょう) 水泳を始めます (日本代表に選ばれる程度の実力) 財力とコネを手に入れます (シーズン真っ只中の航空券を直前に定価で二枚用意できる程度) いずれも無理な場合はオーストラリア人になって日本人留学生をホームステイさせます (ただし必ず凛ちゃんが来るとは限りません) それも無理な場合は猫になってうろつきましょう (うまくすれば餌ぐらいもらえます)
hoshizora	確かにwワロタ 流石俺達の凛ちゃん
toosaka	やっぱり良い子じゃないか
toosaka	アニメから楽しむのもゲームから楽しむのも有だと思うけど 派生作品でも活躍しまくってるから今から派生作品まで追いかけだすとなかなか大変だとは言っとくw
matsuoka	凛ちゃんあのお尻で処女はありえないな
shibuya	君は童貞なのに生きてて恥ずかしくないの?
matsuoka	凛ちゃんのお尻がキツキツなのは事実
matsuoka	。 。 りんちゃんの乳首もあるよ
shibuya	大義である
toosaka	凛としてるキャラ本人にも合ってるよな
toosaka	ZEROの小説だと凛は時臣の母親の若い頃に似ているって事だったな
shibuya	すっかり元通りのホンダカスが気に食わない
hoshizora	(●)(●)●)●)(●))(●)(●)(●)(●)(●))(●)__/ (●)(●)(●)(●))(●)(●)(●),,r==、(●)(●)(●) __(●)(●)((●)((●))(●)(●)(●)ii● l(●)(●)(●)__ / (●)(●)(●)(●)(●))(●)(●)(●゙'‐='"(●)(●)(●) \ _ (●)(●)(●)(●)(●)(●)(●)(●)))(●)(●)(●)(●)_ / (●)(●)(●)(●)(●))(●)(◎)(●))(●)(●)(●)(●) \ _(●)(●,,r==、(●))(●)(◎)(●))(●)(●)(●)(●)_ (●)((ii ,●l)(●))(●)(●)(●)(●)(●)(●)(●) __(●)(●゙'‐='"((●))(●)(●)(●))(●)(●)(●)(●)_ / (●)(●)(●)(●)(●))(●)(●,,r==、(●)(●)(●)(●) \ _ (●)(●)(●)(●)(●)(●)(●)ii ● ))(●)(●)(●)(●)_ / (●)(●)(丿"~"i i(●)(●)(●)゙'‐='"(●)(●)(●)(●) \ _(●)(●)(",, )(X)ヽヽ(●))(●)(●))(●)(●)(●)(●)_ (●)(●)\ ヽXヽヽ(●))(●)(●)(≡)(≡)(●)(●) __(●)(●)((●\ヽ Xヽヽ(●)((●))(●)(●)(ミ)(●)__ / (●)(●),,r==、)( \,",",ソ●(●))(●),,r==、●)(●) \ _ (●)(●)ii ,●l)(●)(●)(●)(●)))(●ii● ;)(●)(●)_ / (●)(●)゙'‐='"(●)(●))(●)(●)(●))((゙'‐='"(●)(●) \ _(●)(●)●)(●)(●))(●)(●)(●))(●)(●)(●)(●) / (l●)(●)(●),,r==、)(●)(●)(●)(,,r==、)(●)(●l;) \ | . (l;●)(●)(● ,● ))(●))(●)(●)ii ● l)(●)(●) | | . (0●)(●)(●゙'‐='"●))(●)(●)(゙'‐='"(●))(●)O) | ,;; (:●)●)(●)(●)(●)(●)(●)(●))(●))(●;) 。 (о●)(●))(●)(●))(●)(●)(●)(●)●》) ( ;●ξ巛:)( ;●ξ(●)(●,--'""ヽ●:( ;) 巛巛ミ巛ミミミ//二二ノ""^ソ彡 巛((ミミ((巛ヘ`\┼┼┼ ,!ヽ 巛王 \"ヽ-;:,,,,,,ノ
hoshizora	凛ちゃん熱が出てだるいよ 優しく看病して欲しいよ…
shibuya	ごめん 変なもんついてたわ おまえらは土曜の夜なのに童貞してるのになー
toosaka	アーチャーが凛から離れたんじゃねーの
toosaka	左下凛「ナニこれ!?芋虫じゃない!」
hoshizora	街頭ビジョンCM 凛ちゃん撮れたからお裾分けするやん
shibuya	アンチはウンチ。 相手するのもアホらしいわ。
hoshizora	前回のメイド凛ちゃんを生み出した時点で蟹には感謝してもしきれないにゃ
hoshizora	凛ちゃんおはよう
toosaka	飯は凛と違って殺人的だけどな そういや刑部先生はライダーの人だったな
toosaka	見えると見せかけて絶対に見えない
hoshizora	凛ちゃんが夜なべをして手袋編んでくれた~
hoshizora	凛ちゃんアニサマお疲れ
toosaka	ごめんねファボ数凛の方が上なんだ
shibuya	バックから突きたすぎて涙出てきた
toosaka	一緒にラーメン食べ歩きしたい
toosaka	アーチャーとかいう役得野郎
shibuya	こりゃえっちな目で見られてますわ
hoshizora	どうせラバーストラップ1個とかにゃ 知ってるにゃ
toosaka	2014年 赤ちゃん名づけ男女年間トレンド 1位 男:陽翔 (はると) / 女: 椛 ( もみじ ) 2位 男:颯太 (そうた) / 女: 心桜 (こころ) 3位 男:蓮 (れん) / 女: 莉琉 (まりる) 4位 男:優 (ゆう ) / 女:惺梛 (せな) 5位 男:琉生 (るい) / 女: 碧 (みどり ) 6位 男:翔 ( しょう) / 女:結愛 (ゆあ) 7位 男:愛翔 (まなと) / 女: 心愛凜 (しえり) 8位 男:悠 (ゆう) / 女:葵 (あおい ) 9位 男:蒼 (そう ) / 女:楓 ( かえで) 10位 男:誠 (まこと) / 女: 凛 (りん )
shibuya	ゴムに穴あけてそうなアイドルランキング1位さん
shibuya	むしろ、それでいこう いつも通りのPと意識しすぎてポンコツ化する凛ちゃん
matsuoka	可哀想だから全く同じ水着と交換してあげる 使用済みの水着はいただきモブー!
toosaka	女の子だから上下同じ色…つまりブラをつけてても女の子じゃないことが? なお、セットでもたまにまったく同色というわけではないことはある。コーディネートやね
toosaka	アーチャーの精神的ダメージが酷すぎていたたまれない トーサカの正体を知れば凛も遠坂に憧れてた士郎もショックで戦争どころじゃなくなるだろう
toosaka	見てしまった場合、物理かガンドを記憶が抹消されるまで叩き込まれるが、いいか?
matsuoka	これだから凛ちゃんが男に甘えるようになるんだ けしからん
shibuya	いじわるでごめんね 照れているだけだよ 寂しくてごめんね きっとこんな感じなんだよ渋凛のイメージは
hoshizora	懐かしいにゃ
toosaka	地元民だけど台風だよ
hoshizora	このスレ笑えるな ここまで必死になって二次元のキャラの悪口を書いてるとは 泣けるね
matsuoka	みんな凛ちゃんに甘いな ぶっかけた水着そのまま置いてくるくらいしろよ!
hoshizora	凛ちゃん年の瀬だけど容赦しないよ ボコボコにしてやるからな
hoshizora	もう無いと思ったらまだチケットケース残ってたにゃ!
matsuoka	チェンジャケBのほうも結構やばいんだけどこれ 渚の後ろから一緒に覗いてるのらぶりんの種族じゃね?
hoshizora	小槌可愛い
toosaka	次スレ行ってみるか スレ立て指定以外にテンプレ追加ある?
matsuoka	イケメンの皆さんは何故凛ちゃんを好きになるの?
shibuya	二期の最後はコンサートだろうけどその前の山場担当は凛か卯月だろうからな
hoshizora	おやすりん
matsuoka	原型は原型師さんのスケジュールや最終コスト調整もあるから 途中で別の監修入ったり彩色が別の人になるのは普通だよw なんで男性の原型師を付けたのかって そりゃ男性の原型師が圧倒多数だから男性が突く確率が高いに決まってんじゃん
hoshizora	かよちんおめ! 凛ちゃんのかーよちんっ!の言い方ホント好き
shibuya	Pは言うほど冷徹な人間ではないと証明されたじゃないか
shibuya	凛おはよう
hoshizora	あと3年もしたら誰も凛ちゃんのことなんて覚えてないよ
toosaka	あれ、なんで時間差の二重に…すまん
matsuoka	つまりビッチ
hoshizora	凛ちゃんバールで殴る
matsuoka	またモブに死亡フラグが
toosaka	はやく2クール目こいよ りんちゃんししこ
toosaka	そういうこと言ってる奴が集まってるスレだろ?ここ
toosaka	女の子の人気の名前1位に凛が入ってたな 他にも葵と桜が入ってた
toosaka	滑稽なのは君だよ、凛小僧 証拠が何一つ証拠として成り立っていないではないか
matsuoka	身長比で体に厚さが足りないのと性格のせいで子犬っぽいんだよね
matsuoka	やだあの人写真に話しかけてる…
shibuya	今日ようやく会えるね凛ちゃん!一週間なげぇ…
shibuya	金髪(小梅)と灰色(輝子)の間の茶髪がまゆ
matsuoka	まこちゃんもご一緒にってのはダメですかね 凛ちゃんがモブ蹴りまくってまこちゃんを求めるのが目に見えてるけども
hoshizora	LWBなんて最初から黄色だろう
matsuoka	遙さんにドン返しとロッカードンされてびっくりしてうるうるするくらいですし 男だし相手によっちゃ殴り合いとかもありえるけど遙さん優しくて良かったね凛ちゃん 多分誰が相手でも殴られるとは一切思って無いんだろうけど
toosaka	凛ちゃんお休み~
toosaka	トッキーと葵さんの最大の功績が凛ちゃんだよ
hoshizora	サムネどう見てもグロ画像しかないにゃー… 虫がだめな奴はマジでやめとけw
matsuoka	今日は怜の番だよ ローテーション組んでるから モブの出番はまだまだ先
shibuya	御褒美だな オティンティンがビクソビクソしちゃうわ
shibuya	アイマスDSのコミック描いた人
hoshizora	凛ちゃん700万DLおめでとう Mスタ衣装楽しみにしてます
hoshizora	しょんぼ凛
matsuoka	それが目的ですよ?
matsuoka	杉本先生ならあるいは
shibuya	とりあえず取り急ぎ
shibuya	ありがとう。ちょっと鮮やかなんだよな。リーマンの悲哀w
matsuoka	それだな あと凛ちゃんの舌に出して見せてほしい
shibuya	なわけない ニ次元のファッションとリアル混同してどうするってだけ
shibuya	うひうう~
shibuya	凛ちゃんに冷たい視線で罵られながら生足で顔面踏まれたいわ。ゾクゾクするぜ。
shibuya	オタクなんだから今更だろう オタクはキモくて当然やねん。
toosaka	士郎とも不幸な運命を辿らないアーチャーとも幸せに慣れるやん? 素敵やん?
hoshizora	秋空早く手に入れたいわ Aメロ凛ちゃんの声にツボってるからフルでも期待してる
shibuya	ちょっと自信過剰とかそういうレベルの勘違いじゃないからな 虚勢で私達は大人気だもんみたいな事言ってるならともかく ガチでまだバックダンサーしかしてない新人が美嘉と同レベルに客呼べるなんて思ってたら池沼レベルだよ だからちょっと脚本がおかしい まあ無理矢理フォローするならあの世界のアイドルに売れない(知名度)アイドルは皆無でスターしか存在しないみたいな設定いれて それで勘違いしてたって思うしかないな Pの発言もぶっちゃけまだ甘いほうだと思ったけどね はっきりいうならあれはあなた達の実力じゃありません、美嘉さんが呼んだ客ですとも言えたわけだし
hoshizora	間違えましたすみません牛木先生
toosaka	ふぅ…
toosaka	しかし、士郎はポーン…
matsuoka	嫌がられると燃え上がる それがモブの性(さが)
hoshizora	いいですともにゃ
hoshizora	2万くらい使わないとフィギュアもらえないんだっけ? 流石にゲーセンでそんなに使えんなぁ・・・
matsuoka	受け受けしいぷりぷりなお尻だった
toosaka	凛ちゃんお休み~
matsuoka	猫に微笑みかけながらの「おいで」が似合う高校生No.1たちばなまこと
matsuoka	モブはドブにでもハメてろ
toosaka	知りたいよな すげー気になる 食べ物じゃない好きなものは判明してるんだけど 宝石磨きと士郎いじり ちなみに苦手なものは電子機器全般と突発的なアクシデント うっか凛きゃわわ
hoshizora	凛ちゃんおやすみ 初夢に凛ちゃんが出てきますように
matsuoka	御子凛の凛ちゃんってくっ付いたら結構甘やかされてそうだから犯し甲斐がありそうだ
shibuya	さすがしぶりん長身だとバニー姿が似合う
hoshizora	40ポイントはヤフオクでかったわ
toosaka	ヤカン取りに行く時のちょっとした動きが凝ってるよな
hoshizora	穂乃果「凛ちゃんはμ'sにいらないよ!」 絵里「ほんとにね」 にこ「その通りニコ☆」
matsuoka	凛ちゃんの顔ダニになりたいんですよ! モブなんかに食べられちゃたまらんのですよ!
hoshizora	取り敢えず22連したらかよちんが覚醒した…
hoshizora	凛ちゃんの起源は古代メソポタミア文明まで遡る
hoshizora	凛ちゃん冬休みにスノボ行って人気者に
matsuoka	えっモブもお返しもらったし体ペロペロしたモブ…?! 凛ちゃん皆に良い顔しすぎモブ…
toosaka	ふむ あの慎二に迫られてるシーンはボインボインだったが…
toosaka	スタイルいいよね
toosaka	アレの為だけに新規立ち絵作ったスタッフに狂気を感じたwww
toosaka	おはよう凛ちゃん
shibuya	せっかくのしぶりんのラブアローシュートを弾くなんて酷いPだな。
hoshizora	かよちんセンターだと新規UR凛ちゃん結構引けるしこれは嬉しいんだけど凛ちゃんセンターにしてもいまいち新規URかよちん引けないんだよなぁ やたらにこえりがブロックしてくる…うーん
matsuoka	宗介さんもCDドラマの宗介さんなら「いいじゃねーか」って言ってくれる気がする
shibuya	キャラデザの杏仁豆腐は二十代の女性だよ けっこうきれい目だったな
shibuya	凛もPに失望しかけてるとなるとちゃんみおだけの問題じゃ済まなくなってるな
hoshizora	はいにゃ 【商品情報】ラブライブ!神田明神コラボグッズ第3弾のお知らせです。 ?p=7479 >・凛(打出の小槌) 神田明神で主祭神として祀られるだいこく様が持つ小槌。振れば様々なものが出て来ると言われ、昔話にも度々登場する縁起物です。
hoshizora	これかわいいよな こんな娘町で見かけたら目的放り投げて後ろついてくわ
matsuoka	寝てから!彼氏が寝てからにするから!
hoshizora	かわいすぎて脳みそ破裂した
hoshizora	凛ちゃんおやすみ
matsuoka	き、着せてあげてるところかもしれないよ?
matsuoka	したらばに新しく立てるか難民の避難所をしばらく借りるかだな
matsuoka	それは凛ちゃんのおりんりんが恥ずかしいことに! てかどっちにしても乳首立ってて恥ずかしいよ凛ちゃん チンコで隠してあげよう
matsuoka	アルター凛ちゃんのお尻をにぎにぎしたい
hoshizora	凛ちゃんのラーメンにウンコ入れたわ
matsuoka	凛ちゃん体温高いんかな 外人さんは冬でも太陽出るとすぐ半そでになるけどそれと似たようなもんなのか それともただエロい子だからなのか
hoshizora	おはりん アニメイトって女性中心だし、やはり凛ちゃんはお姉さまに好かれるタイプか
hoshizora	まことに残念ですが 要望でメールだしてそれが多ければシリアル使用期間復刻とかあるかもしれないね
matsuoka	?mode=itemdetail&ik=143 これももは凛ちゃんのおっぱい当たってね?
matsuoka	京アニから円盤来た 想像を絶する鮫凛と怜凛
shibuya	案外悪くない
matsuoka	タンクトップって授乳しやすそうだよね
toosaka	それでいい
toosaka	対イリヤ、美しい戦闘だった
hoshizora	凛ちゃんのバッグにゴキブリ忍ばせる
matsuoka	御子柴部長来て本当嬉しい 御子凛もっと増えてもいいと思う ドラマCD2でどうか御子凛にも会話を…
matsuoka	公式マジで凛ちゃん全方面から総受けで楽しいわ 人外にまで好かれるとか凛ちゃんマジビッチ
matsuoka	匙の怜凛はなんかおねショタの凛ちゃんっぽかった
matsuoka	凛ちゃんのエロパワーによって生かされてるモブ
shibuya	むしろ座られたい
matsuoka	鏡見ろモブ
shibuya	一体いつから武ピーがでかいと錯覚していた?
shibuya	どうせなら星空凛ちゃんで
matsuoka	今はラリアで風紀を乱してるんだろうな
matsuoka	それは関係ないみたいだよ それぞれのスレでそれぞれ好きな方言使うか使わないか決めていいらしい
hoshizora	(>ω<)どきどき・・・
matsuoka	不細工はだめ
matsuoka	キス凛の時代キターーーーー!! 凛ちゃんキスミーの前だとまるでショタ凛ちゃんのような表情だったし特別な関係なんだろw
hoshizora	おい!またぱんーちかよ
shibuya	妊娠したから金よこせとか言われそうで怖い
shibuya	まだ不信感はあるけど未央が取り成したから とりあえず納得したという感じかね なんだかんだでまだ爆弾あるよな
matsuoka	遙受けとは言っていない
shibuya	どっちかと言うと猫属性の凛なんだよなぁ
matsuoka	-763 ありがとう!! ツートップ対決やべえええめっちゃ萌えるわ同人のようだ… そして真凛の平和バカップルっぷりにワロタw 凛ちゃん推し鮫柄凛も御子凛もはぁ…ごちそうさまです
shibuya	アンチに触れるな
matsuoka	おへそちゅっちゅしながらお尻に手突っ込んでかきっかき
shibuya	デレマスのまゆはPが別だから安心
toosaka	忘れるなよ 凛のぼっち飯はお前と違って誘いがあった上でなんだぞ
toosaka	凛や葵ならまだわかるが読み方がわからないわけのわからん名前はやめてくれ 四季って名前はどうかな?
matsuoka	何故アナニー禁止なの? あんなにお尻が大好きなのにかわいそうだよ!
matsuoka	ツイのまこりんワードめっちゃワロタ 凛ちゃんビッチ
shibuya	渋凛ってツインテールとか髪型を変えてみた方がもっと可愛くなると思うよ
hoshizora	?v=nLv6rjxN_jM&list=UU8CmWKmGU8rk5_RuvMZBtpQ
toosaka	ufoさん通販しようぜマジで
toosaka	凛ちゃんお休み~
toosaka	メンヘラで薬物依存です ちょっとメンタルの調子が悪いので回復魔法級の凛ちゃんの画像ください
toosaka	今週も凛ちゃんのスカートは鉄壁だったよ…
toosaka	植田佳奈はまだヒロイン頑張れるんだな……
hoshizora	あー凛ちゃんの中気持ちいよ 本当にエロくなっちゃったね凛ちゃん
hoshizora	様々な動物と仲良く遊んでる凛ちゃん想像してみろ かわいい
toosaka	ネグリジェであの寝相では確実にあんなところもこんなところも丸出しで見放題だな…
matsuoka	どれ見せてみなさい おじさんが確かめてあげよう
toosaka	もはやなんの話だよww
toosaka	性的すぎますね…
hoshizora	今日コップもらったけど凛ちゃん真ん中にいるじゃん嬉しい
hoshizora	来たにゃ
toosaka	主人公がいつもロンT1枚だから気を使ってるんだよ
hoshizora	4日花陽
shibuya	凛ちゃんの同人誌増えろ!!
matsuoka	凛ちゃんは悪いモブに薬を飲まされたのか これは凛ちゃんのおちょぼ口とモブのチンコがキスして眠りから覚める予感
toosaka	そんなん聞いたことないよ 実況できのこが凛がヒロインって言ってたもん
matsuoka	モブにチュウチュウされてぷっくりチェリーになった凛ちゃんの乳首から甘いお乳出てくるんだね
matsuoka	凛ちゃん好きだからひどくしてしまうんだよごめんね おっぱい吸うよ
toosaka	むしろ履いてない!
matsuoka	時々穴に指を滑り込ませると可愛い声で啼いてくれるよ
matsuoka	14話ヤバイな メイドって聞いて凛ちゃんも!?って思い浮かべる岩鳶とかw特になぎりんw 怜凛真凛遙凛百凛宗凛貴凛全部おいしかったです 凛ちゃんに仕留められるツートップには笑った 流石凛ちゃん
hoshizora	ヤメタゲテー
matsuoka	レポ乙です! ツートップ凄い萌えたけどまこりんそれ以上ってヤバいな 凛ちゃん彼氏多いビッチだけど照れたり奥手発揮するの可愛すぎる 彼氏達もそんな所に惹かれたんか
toosaka	エセ神父「私も悪かった気がするようでしない」
shibuya	優等生はないw 言葉使いでアウ!
toosaka	カーニバルファンタズムもルヴィアさんいないのか
toosaka	凛ちゃんはかっこよすぎるよ
shibuya	総集編であのぶさいのがしゃっべってると思うと かなり萎えた
shibuya	抱きしめて思いっきり深呼吸したい(*´д`*)
matsuoka	モブは凛ちゃんから片想いされてる方
shibuya	夜勤病棟ってエロゲに出演したらサイコーに輝きそう
matsuoka	円盤やべええええ はるりん怜凛宗凛にとりんももりん鮫凛じゃないか 凛ちゃん相変わらず全方面で燃料くれるな!
toosaka	凛好きとしてはどれを選ぶべきか… おめでとう! 今日も真っ先に売り切れたみたいだな…
hoshizora	可愛すぎて夜しか眠れない
toosaka	凛ちゃん可愛すぎ
toosaka	あればっかりはなあ 期待はしてるけどアニメで無くても文句は言えない
