shibuya	\___人 ー──────<⌒〈 /::::::::::::::\___ -=====- __〈\ 丶 .::::::::::::::::::::::::::::::::::::::::::::::::::::::::::::::::::::::::\_>、〉 . /:::::::::::::::::::::::::::::::::::::::/ :::::::::::: イ::: /:::::::::::∧ . ,::::::::::::::::::::::::/ :::::::::: /:::::::::::/ |:::イ:::::::::::::::::ハ . ;:::::::::::::::::::::j/ :::::::::: /:::/Χ |/ |:::::/ ::::::::: | キッ . |:::::::::/::::::∨::/ ::::: /イJ卞ミ\_,/ |::/|/::::::八| . | :::::/::::::/7:::::::::::::/ Vツ ´ j斗k:j:::∧ . | /::::::人|::::| ::::: | ー 'ツ/::|/::ハ . /::::::::::::::::::|::::| ::::: | \.:::::::::::i:::| /イ :::::::/ :::::::i /| ::::: | u /::::::::::::i:::| . / 八::::/ :::::::: i::::| ::::: | ⊂=- ∧ ::::::::: i:::| /::::: /:::::::::: 「「八:::::::ト .::::/V:::::::::i:::| . /::::: /:::::::::::::ノ \:::ヽ≧=- __/:::/ |::::::::::iリ /:::::::::::::::::::: /_ノ⌒)⌒)-、::\_:::://:::::;:′│:::::: / . / :::::::::::::::: / >< ¯¯`'く):::::Ⅵ/::/ │:::::/ /::::::::::::::::/{/ {\:::`''< |ノ::::| .:::::::::::::::::/{_/ / ∨ハ:::|\| /::::::人 ..:::::::::::::::::/ノ7/ '⌒リ\〉 '⌒|/ :::::::::::::/{r< イ 〈\__〉 / ::::::::::〈⌒7 / | ⌒{く\ :::::::::::::ア | \ \)\
toosaka	今週はキャスター戦までかな 今までと違って流石にここは戦闘増やせないか
hoshizora	おはりん しかしやっぱアフリカはないだろう、人気上位3人とシチュ比べたら本気で差がありすぎ
hoshizora	凛ちゃんのおまんこ濡れ濡れだね そろそろ挿れるよ
toosaka	まぁ原作はとっさに駆け込む路地裏にしてはちょっと狭すぎたからなぁw
matsuoka	14話見た 真っ先に思ったのがこれでツートップで3Pできるんじゃない!? だったんだけどTLではそういう感想見なくて でもここ来たらお仲間が沢山いて安心したw 男からのあーんに応えるのにいちいちあんなポーズとって尻強調するとか やっぱり凛ちゃんビッチだわ
shibuya	親しい関係になったらの匂い嗅がせてもらいながら イジってほしいと思う
toosaka	どこ? 見たい!
hoshizora	今みたいになる前エジプトの南のほうまでいったことあるけど、アフリカの入り口みたいですげえ良かったよ だから迷わず投票した 状況がああでなければ本気でもっと南まで行きたいけど、生きてるうちは無理だろうな…… 個人的に凛ちゃんに合うのはアメリカだと思ってる 先住民の名残ある荒野をカウボーイルックで馬を駆ってどこまでも自由に走ってほしい
hoshizora	凛ちゃんは僕たちの心の中にいる
toosaka	ああああああスカートからメスの香りがしておかしくなりそおおおお
hoshizora	台所でラーメン作ってる凛ちゃんを抱きしめて後ろから挿入したい
matsuoka	まさかとは思いますが、この「モブルート」とは、あなたの想像上の存在にすぎないのではないでしょうか
shibuya	まだこういうのがいるのか
hoshizora	凛ちゃんの為なら2万も惜しくねえ
shibuya	腹筋と首がつらそう
toosaka	士郎と路地裏に隠れるシーン見直したら士郎押し付ける度にスカートヒラヒラしててなんか凄く興奮した
toosaka	うひょう! 897 名前:風の谷の名無しさん@実況は実況板で@転載は禁止 [sage] :2014/12/28(日) 01:07:53.40 ID:6+2Qk9On0
shibuya	この娘ってポツリ、ポツリとつぶやく一言が碇シンジをイメージさせるよな
shibuya	オナニーとセックスは違うんやで
matsuoka	凛ちゃん宗凛と遙凛で自分を使い分けてるのか
shibuya	変態ばっかじゃねーか
shibuya	まずはハニー呼びを照れなくできるようせんとな
toosaka	凛視点でもっと見たい
hoshizora	アフリカン凛
hoshizora	センターだろうな
shibuya	凛ちゃん、おはよう!!
matsuoka	凛ちゃんって釣り目なのかな タレ目でも釣り目でもないような気がするんだけど
shibuya	おぎゃる
shibuya	これはいい
shibuya	乙 未央と一緒に頭を下げる凛ちゃんが良かった まだまだ暗中模索の状態だね凛ちゃんは
hoshizora	一日2000円で10日ゲーセン行けばいいにゃ
matsuoka	清十郎さぁんて呼びながらモブに揺さぶられてる凛ちゃんに大興奮
matsuoka	そこは泣かないでよめんどくさいなぁって言って 凛ちゃんのMがときめく感じで
matsuoka	そしていきなり入れよう
toosaka	す、スマホでフェイト!
toosaka	茸はロマンチストだよな
toosaka	ウオシュレットネタがおかしな方向に伝わっているんだろうかw
matsuoka	メイド服の凛ちゃんの谷間はどうなってるんだろ
hoshizora	凛ちゃん年末大掃除にゃ
hoshizora	ワロタ 凛ちゃんの口についたのりをキスして溶かしてあげたい
matsuoka	もも→パイズリ 宗介→婚姻届 まこちゃん→バック 似鳥→凛ちゃん1人ケツマンえっち
toosaka	型月の方じゃ20スレ超えてるしな
shibuya	流石にヘソピアスまで行ったらどうかと思うが耳くらい大した事じゃないだろ。
toosaka	どこの特典がいいのか やっぱりカフェか
hoshizora	星空おまえ男なんだろ なんでスカートなんか履いてるんだよ気持ち悪い
hoshizora	この勢いなら次のセンターは凛ちゃんだな
hoshizora	凛ちゃん人間やめなよ
toosaka	ufo凛はお嬢様っぽいのが良いな 96 名前:風の谷の名無しさん@実況は実況板で@転載は禁止 [sage] :2014/11/20(木) 21:49:00.19 ID:EGlZ+pYe0 来年のカレンダー
shibuya	早く濃厚なP凛をみたい
shibuya	シコリティってなんですか?
toosaka	ユニクロ民の俺だがしまむらはバカにしてるよ
matsuoka	ありがとうございます! 遙凛宗凛も安定のようですね
matsuoka	凛ちゃんに髪出しすると美味しそうになるよ
hoshizora	こんな感じ フィギュア画像新聞裏にもあったにゃ
matsuoka	お腹は今のままでいいかなあんまムキムキなりすぎると真琴と差なくなるし
shibuya	正妻w
toosaka	掻っ攫いたい
matsuoka	遙さんと宗介の3Pだと凛ちゃんの奪い合いで協力とかまったくしないんだろうなあ… 凛ちゃんが壊れちゃう…よしここはモブが!!
shibuya	凛が店番してる時にブリーフパンツ一丁で店を訪れて「この僕に似合う薔薇の花を一輪くれないか?」って凛から買いたいね!
hoshizora	凛ちゃんはメンバーみんなから嫌われてるよ
matsuoka	宗凛兄柴 この並びは神だという事が本編でわかりました
toosaka	色々サーヴァントのコスプレさせよう
toosaka	どこかの妹キャラと間違えてませんか? 凛は巨乳とかではないがスタイルいい筈
hoshizora	アフリカじゃなくてアメリカで良かったんじゃないかにゃ?
toosaka	普段もあのネグリジェで、ベッドから半分ずり落ちたりしてるんだろうか
matsuoka	太股も素晴らしい
matsuoka	凛ちゃんの中あったかいよぉ
shibuya	イヤだ
matsuoka	ではワタシは四つん這いにしよう
shibuya	渋凛は征服と私服意外に何が似合うかな? 和服とか パンクロックとか似合いそうだな
matsuoka	モブに抱かれてるからあんな幸せそうな顔なんだよ?
matsuoka	まさかの触手凛再び…?
hoshizora	レス番飛びすぎで怖いなここ
shibuya	しぶりんはアニサマよりロッキンやサマソニ行くタイプ 厨房の時は皆は緑日やオアシス、レッチリだった所を しぶりんはニルヴァーナやスマパン、レディヘを聴いてた
matsuoka	お誕生日ボイス聴いてきた なんだあれ誘ってるようにしか聞こえん
hoshizora	凛ちゃんおはよう
shibuya	俺が普段見てるキャラスレはシモネタばかりだから このスレの住人は期待していたほどエロ話が少なくて戸惑っている
shibuya	制服凛ちゃんと放課後教室ックスしてェよ
matsuoka	そうだそうだ
shibuya	CPは髪の長い子が多いからヘアアレンジ面白そう アニメでもやってくれないかな
matsuoka	凛ちゃんの穴という穴ぐちぐちするモブ
toosaka	本編以外で凛とイチャイチャできるゲーム教えて下さい
toosaka	ロングブーツ似合いそうなのに 寒いから履かせてあげて
matsuoka	ガチムチで凛ちゃんの扱いうまい彼氏ね
toosaka	胸の谷間をだいぶ強調してるね今回の凛
matsuoka	岩鳶SCの姫 ↓ 鮫柄水泳部の姫 ↓ BJ水泳軍団の姫←イマココ
shibuya	こっちもってくるなよ
hoshizora	凛ちゃんキモいキモいキモいキモいキモいキモいキモいキモいキモいキモいキモいキモいキモいキモいキモいキモい
shibuya	ちゃんみおみたいに単純ではないからなあ 深読みすればするほど凜ちゃんがいとおしくなる
toosaka	それは熱いな
hoshizora	凛ちゃん仕事納めさんおはようございます
shibuya	ありがとうございます!
matsuoka	分からないならモブがチェックするモブよ!
hoshizora	強くなったな・・・凛
hoshizora	覚醒できてないRだけどんどん増えてく…
matsuoka	女性用の水着着れば恥ずかしくないよ凛ちゃん!
hoshizora	凛ちゃんボコボコボコボコボコボコボコボコボコボコ
shibuya	制服のフィギュアが欲しい figma以外にも出してくれ
hoshizora	キュット上がったおやすりん
shibuya	みんなアニメ本スレに夢中
toosaka	見えないからこそ挑むんだよ
matsuoka	凛ちゃんの乳首えっちだね モブにいじって舐めてほしいって主張してきてる!
matsuoka	凛ちゃんが1番ツン見せる彼氏って誰だろう
toosaka	きのこが同系統だと発言してるんだよな 原型が同じ つまりきのこが好きなタイプなんだよな
shibuya	匂いフェチかよ嗅いだだけでイキかけてるじゃねーか
hoshizora	凛ちゃんのお腹バットでフルスイング
shibuya	どれも可愛い(ノ≧▽≦)ノ
matsuoka	じゃ今とりあえず避難所立ててみる?
shibuya	エロが見られればなんでもいい連中だからなあ
matsuoka	奥手処女だからまこちゃんも安心
toosaka	1時間放送まだあるらしいね つまり凛ちゃんを観る時間が増えるということだ
hoshizora	初心に戻ることって大事だね
hoshizora	おは凛ミラクル
matsuoka	普通にDKの悪ふざけでもいいな
shibuya	凛ちゃん犬みたいで可愛いよ
matsuoka	そうだな 当分並行しといてここに残れそうなら残る方向がいいな
toosaka	UBWの一番くじやんねえかなぁ
shibuya	魚はやめるニャー
hoshizora	凛ちゃんの陰毛ブチブチむしり取る
matsuoka	凛ちゃんいつもアンチに視姦されてるの?
toosaka	セイバーが獅子、美人教師が虎、凛が猫 セイバーライオンや冬木の虎がいるんだから遠坂猫がいてもいいじゃない、と思ったがそれがカレイドルビーか…哀れな
toosaka	めでたいものですから! 凛は長い黒髪が揺れるのが綺麗だから、風の表現はどんどん取り入れて欲しい 風が空へゴウッと巻き上がったり、前後にザーッと吹きすぎていったり、サヤサヤとそよいでいったり、そんな空気感を髪で表して欲しいな
toosaka	ガンド撃ちは初等呪術だが、 物理的破壊力を持たないはずのガンドが、 高い魔力密度から拳銃弾並みの物理的破壊力を持ったものになるとフィンの一撃と呼ぶ 凛はフィンを機関銃のように連射できるためフィンのガトリングと呼ばれる
shibuya	?v=MDZJYVyofA8 凛、かわいいよ。
hoshizora	今度の投票はこのスレ覗いて 多そうなのに投票するにゃ
hoshizora	凛ちゃんSuper Sonic Levelさんおはようございます
hoshizora	凛ちゃん久々に風呂上がりのクリアアサヒですよ
hoshizora	推しとか関係なしに全部の中で ダントツで凛ちゃんの服が好みだ
toosaka	英霊トーサカさんはベヨネッタ様のようなんです
matsuoka	まこちゃんは凛にゃんで遊んで可愛がりそう 似鳥はそんな凛にゃんを陰からこっそり見て凛にゃんにときめいてそう
toosaka	誰と組んでもサマになるよね
hoshizora	凛ちゃんがボコボコにしてやるんですお!?って言ってる画像ください
shibuya	お主天才でござるな
matsuoka	猫耳凛ちゃんはまこちゃんにしか靡かないから
matsuoka	種目は何だ?
shibuya	しぶりんみたいな美少女も割れ目からおしっこ出してるんだと思うと硬くなりすぎて痛い
shibuya	今発見したしぶりんの魅力の1つ アホ毛がない
matsuoka	そもそもモブは凛ちゃんとセッ出来ません
hoshizora	ぶっちゃけシチュとか関係なくいつも通り推しに入れるだけの投票だからどうでもいいにゃ
matsuoka	ねえはるかさんあれ凛ちゃんの肩抱くキスミに嫉妬して撃ったってことだよねあれキスミもわざとだろ~とかいってるしさ… あと一瞬出てきた猫、もしあれが凛ちゃんが飼ってる猫だったらすごいね茶色毛に緑の目だったよ…誰かに似てあっ(察し)
shibuya	こんなの見つけちまったぜよ ってことはこの歌がそうだな ?v=KCPY5VscATA
shibuya	きも くそ童貞が
shibuya	凛こそ最高なのだ
shibuya	じゃあ、俺が凛もらってくからな。
hoshizora	セガ公式の呟きによるとこのソニックはぬいぐるみらしいぞ
hoshizora	この巻物ラーメンの種類が書いてあるのか
matsuoka	違う違う解禁日ってのがワインとかみたいだなって コンシェルジュ凛ちゃんにぶっかけたい
toosaka	いっしょにぼっち飯食おう!!
toosaka	凛はかっこよくて可愛いってことさ
toosaka	凛、
shibuya	教室で放課後ックスしたい。声出したらバレるぞって必死に喘ぎ声我慢させたい
shibuya	かわいい
matsuoka	宗介「雪よりまぶしい」 兄柴「チョモランマ級」 百「たに…ま…!」
matsuoka	人外に好かれる凛ちゃんの迷惑がりが半端なさそうなのがまたいいわ まんじゅうの顔かわいい
hoshizora	凛ちゃんボコボコボコボコボコボコボコボコボコボコボコボコボコボコボコボコボコボコ
matsuoka	知ってた
matsuoka	でもお尻揉まれると怒るよ
hoshizora	うぃんかべー凛ちゃんのフルプライスフィギュアが欲しい
hoshizora	水橋って何にゃ? ナビィの中の人しか知らないにゃ
shibuya	二人きりになったこと意識してるって はっきりわかんだね
shibuya	というか例えば有名アイドルのバックダンサーについて自分がどれくらい知ってるか想像してみたらいい それも何度も何度もやってるとかじゃなくただの一回でどれくらい意識できてるか マニア中のマニアしかそもそも知らないだろう
matsuoka	モブはどうせ手出し出来ないだろうと高をくくってる顔だよ おもいっきり押さえつけて乳首噛みたい
toosaka	ケツえろすぎんよー
hoshizora	下校途中の凛ちゃんに後ろからそっと忍び寄り、顔に麻袋をかぶせる 咄嗟の出来事に驚き身動きの取れない凛ちゃんを側に駐めておいたワゴン車の中に強引に連れ込む 「何するの!?早くおろしてよ!!」 麻袋の下からくぐもった声で叫び、ドアを蹴る 声を聞かれてはまずいので助手席のブラックジャック&#8211;&#8211;&#8211;手製の、袋に石を詰めた簡素なものだ&#8211;&#8211;&#8211;を手に掴み、後部座席に横になって乗っている凛ちゃんの頭に思いっきり振り下ろす 凛ちゃんは死んだ魚のようにぐにゃりとしてそのまま座席下のスペースにはまり込んだ 数日前からドリンクホルダーにある缶コーヒーの残りを一気に飲み干すと、山の方に向け車を走らせた
matsuoka	凛ちゃんは面食いじゃないけど凛ちゃんの周りにはイケメンが多いんだよ 外見も中身もモブなんかと比べ物にならないイケメンが
matsuoka	椅子に座ったらラブリンに乗ってたはラブリンあるあるだと思う 制服溶かしちゃ駄目だよラブリン
hoshizora	あー凛ちゃんあー凛ちゃんあー凛ちゃん 気持ちいいよ凛ちゃん いくいくあー!!!
toosaka	ウォシュレットってなんだよ めっちゃ気になる
matsuoka	モブも優しくて筋肉ムキムキでストロークの速い長身イケメンになれば凛ちゃんが寄ってくるぞ
shibuya	せっかくだけどあんたのパンツなんか見たくないです。ッて言うか、汚いもん晒すな!ってなる
shibuya	三枚目の手かわいすぎんだろ・・・
shibuya	気が強いけど心許したら甘えてくるタイプの凛
hoshizora	かよちんってことりちゃんとしか組んでないのか
hoshizora	凛ちゃんキモすぎ
shibuya	なつきちがしぶりんと音楽談義で盛り上がって るとこに加わろうとするも、さっぱり分からず アウェー感いっぱいで拗ねる多田さん
toosaka	「見えないけれどもあるんだよ」 「本当に大切なものは、目に見えない」 凛のスカートの下について、詩人の言葉で語るならばこの二つ あのすばらしい太ももは、そこに繋がっている うん、眠いとアレだな色々と
toosaka	ちょっとおっぱいが固そうだが 補って余りあるニーソだよな
hoshizora	凛ちゃん不人気
toosaka	本編でちゃんとヒロインしてるから、ネタで面白くいじれるっていうのもあるしな
toosaka	PC版しかなかった当時は気づいていなかったけど、自分もレアルタやった後あの可愛さに改めて気づいた 凛も士郎も初々しすぎて眩しいよ…読んでてドキドキ感半端ないんよ こういうのはまずキスしないと駄目と言われて、素直に従う士郎が純情すぎる そのうちだんだんテンパってケダモノに変身する士郎と、涙を浮かべて恨み言を言う凛に萌え死んだ アニメはレアルタ準拠なんだろうけど、どこかであのキスシーンだけはやって欲しいなあ
matsuoka	ももは凛ちゃんのおっぱい触りながら寝そう
toosaka	円盤のアニメイト予約特典らしいよ
shibuya	四つん這いにさせたウッディとか良さそう
toosaka	ああ^~
matsuoka	その鮫凛が詳しく知りたいわけですよ
shibuya	凛ちゃんがシャンプーと香水と汗の混ざった匂いがしてきそうなエロかわいさだから そりゃ変態も集まるわ
hoshizora	可愛いなほんと
shibuya	まあ好き嫌いは分かれそう 凛好きはライエも好きそう
matsuoka	凛ちゃんベリー系の髪色のおかげで白いのかけると美味しそうなんだよな
matsuoka	どっちでもいいよ 取り敢えずアリエッティさせてもらおう
shibuya	独占欲強くて重いからね Coの20代後半以上のアイドルにも引けを取らないレベル
matsuoka	それを履くしかない凛ちゃん可愛いよ
matsuoka	チンポグルメで耳ビッチとかどうなってるんだよ奥手だろ凛ちゃん
hoshizora	アフリカ...!?
hoshizora	凛も買ってきたにゃ
hoshizora	凛知ってるよカシオペアから7つ数えた南にあるのがミラージュだってこと
toosaka	おやすみ凛ちゃん
hoshizora	最近凛ちゃん調子に乗ってるな 身の程をわきまえさせてやる
toosaka	格ゲーの凛エンドとルヴィアエンドは明るい終わり方で良かったな あれもシナリオきのこだっけ
hoshizora	NG宣言、NGアピールは効いてる証拠! どんどんくそねこをぶっ叩いていこう!
shibuya	おっぱい結構あるからね トップは3人中一番低いけどウェスもかなり細いのでアンダーも低いだろうし 犬しっぽ見せて欲しいね
matsuoka	凛ちゃんチンポグルメなのかよ
matsuoka	まこちゃんの優しいねのところな まこりん!まこりん!
shibuya	円光といえばsakiで円光禁止スレと円光スレに分割したキャラがいたな
toosaka	士郎しね
hoshizora	それは素晴らしいにゃ
matsuoka	まだぶっかけの仕事が…
toosaka	あんなにおっぱい大きくなるとはね
toosaka	単に普段着にウール(?)加えただけでは
matsuoka	あの美しい足はいただけるんじゃないだろうか
shibuya	いや俺の嫁なんだが…
matsuoka	まこちゃん久しぶり ゆっくりしていってね
shibuya	そんなどうでもいいことよりしぶりんのパンツに顔埋めたい
toosaka	賓乳(気品のある貴族の乳
matsuoka	自分は14話あたりで少しは関係改善されるんじゃないかと思ってる 遙さんは新婚旅行、宗介は待ってるで心動かされたしそこまでしてくれるなんて自分が本命と思うだろ 2人共こいつが何しようと俺が凛の本命だし…って心に余裕が出るんじゃないかな
matsuoka	年上とエッチのときは敬語の凛ちゃん フル勃起不可避
shibuya	女性名なぜ短く? 「凛・めい」1字・2音時代へ ?dg=1
shibuya	違う
shibuya	それポニテだろ。
matsuoka	飲み込まれて服溶かされて全身気持ち良くされちゃうやつじゃん!
hoshizora	凛ちゃんそのふざけた喋り方をやめるまで何回でも殴るからね
toosaka	見えないからこそ憧れる
shibuya	凛ちゃんは女子高性かわいい
hoshizora	素直に喜べない凛ちゃニスト
hoshizora	アフリカとかエボラ関連の事件でイメージ最悪だわ
matsuoka	何言ってんだ 凛ちゃんはモブのこと大好きだよ ね?凛ちゃん かわいいお知りモブのちんぽでじゅぽじゅぽされるの大好きだよね 気持ちよすぎて泣いて気絶しちゃうもんね
shibuya	おつきあいは大事だからねってパチスロ代を渡して頑張ってねって送り出す某ゲームキャラの絵を思い出したわ
shibuya	何となくだが、凛の思い描くPとの関係を、既に体現しているのが姉ヶ崎さんな気がする。 凛の着きたいポジションに既にいると言うか。
toosaka	親父が不意打ちで刺された時こんな顔してたな まぎれもなく血だな 優雅()
matsuoka	そして鮫柄のアイドル
hoshizora	spモード解除した糞運営は荒らしと一緒に死ね
shibuya	ごっつぁんです
hoshizora	凛ちゃんに水かけてベランダに放置
matsuoka	足で洗って欲しいぃ 足でコキコキ
hoshizora	【ラブライブ!】星空凛はソニックとコラボ可愛い>ω</39
matsuoka	旧尻のあまりのエロさにツートップあたりの監修が入ってしまったのか まあまだ全然エロいけどな
toosaka	二枚目の顔大好き
shibuya	少なくともお前より中の人の解釈の方があてになるけどなw
toosaka	俺と一緒に、お昼ご飯食べませんか?
matsuoka	キスミーよりモブの方が長い間凛ちゃんを見つめてきたんですけども
matsuoka	バレス 14話見た人かな? かっこいい遙さんと宗介の画像で標的凛ちゃんってのだけ見たw
hoshizora	水泳凛ちゃんの隣だけが分からない…後、初詣凛ちゃんも欲しい所
shibuya	視聴者がPに向かって思ってた「お前がはっきり言わんのが悪いんじゃー」ってことをビシッと言ったしぶりん好き 今回のMVPは卯月ちゃんだと思うけど、しぶりんのセリフも一つ一つ良かった あと、迷いを感じた時には思い切り頼られたい
toosaka	原作だと「じゃあずっと味方だ」が アニメだと「じゃあずっと一緒だ」に変わってるだな 拘りを感じる
toosaka	前髪下ろすと若くて釣り目な葵さんだったな
matsuoka	それぞれが凛ちゃんの彼氏としての反応ノルマを達成しておる
hoshizora	アフリカ大陸って一応ロシアの倍近く広いんだけどな 風評被害ってレベルじゃねぇ
hoshizora	凛ちゃん新聞くださいなー
shibuya	いいおっぱいだ
matsuoka	遙さんを応援するんだろ?→あれ、まこちゃん寄り!? こういう所が男を勘違いさせて彼氏増やす原因だと思いますね 両方に矢印撒くあたり凛ちゃんビッチ
hoshizora	いきなり凛ちゃんの頭叩いたらどんな反応するか見てみたい
hoshizora	可愛すぎて100枚くらい買ってしまう
toosaka	家計事情って新刊出た?セイバーメインが最近出た記憶しかない
shibuya	フリーザがアイドルになったとかいう動画おもしろいね くそわらってしまう
toosaka	そうだね、ごきぶり
matsuoka	凛ちゃんのこと好きすぎて胸が苦しいよ 腋舐めたいよ
shibuya	凛を後ろから抱きしめてずーと匂い嗅いでいたい こんな事まで許されるぐらい信頼されるシチュを想像するだけで たまんねえぜぇ・・・
